{
  "schema_version": "o2.candidate.v1",
  "maturity": "researched",
  "contract_frozen": false,
  "synthetic": true,
  "edges": [
    {
      "lineage_id": "lin-revenue-apr",
      "observation_id": "obs-revenue-apr",
      "input_raw_record_ids": ["raw-eq-10k"],
      "transform_id": "o2.candidate.effective_version",
      "transform_version": "o2.candidate.v1"
    },
    {
      "lineage_id": "lin-revenue-jul",
      "observation_id": "obs-revenue-jul",
      "input_raw_record_ids": ["raw-eq-10k", "raw-eq-10ka"],
      "transform_id": "o2.candidate.effective_version",
      "transform_version": "o2.candidate.v1"
    },
    {
      "lineage_id": "lin-ooo-may",
      "observation_id": "obs-ooo-may",
      "input_raw_record_ids": ["raw-eq-ooo"],
      "transform_id": "o2.candidate.effective_version",
      "transform_version": "o2.candidate.v1"
    },
    {
      "lineage_id": "lin-revenue-aug",
      "observation_id": "obs-revenue-aug",
      "input_raw_record_ids": ["raw-eq-10k", "raw-eq-10ka", "raw-eq-split"],
      "transform_id": "o2.candidate.effective_version",
      "transform_version": "o2.candidate.v1"
    },
    {
      "lineage_id": "lin-quote-aug",
      "observation_id": "obs-quote-aug",
      "input_raw_record_ids": ["raw-eq-quote", "raw-eq-split"],
      "transform_id": "o2.candidate.effective_version",
      "transform_version": "o2.candidate.v1"
    },
    {
      "lineage_id": "lin-split-aug",
      "observation_id": "obs-split-aug",
      "input_raw_record_ids": ["raw-eq-split"],
      "transform_id": "o2.candidate.effective_version",
      "transform_version": "o2.candidate.v1"
    },
    {
      "lineage_id": "lin-split-corr",
      "observation_id": "obs-split-corr",
      "input_raw_record_ids": ["raw-eq-split", "raw-eq-split-corr"],
      "transform_id": "o2.candidate.effective_version",
      "transform_version": "o2.candidate.v1"
    },
    {
      "lineage_id": "lin-splits-sep",
      "observation_id": "obs-splits-sep",
      "input_raw_record_ids": ["raw-eq-split", "raw-eq-split-corr", "raw-eq-split-oct"],
      "transform_id": "o2.candidate.effective_version",
      "transform_version": "o2.candidate.v1"
    },
    {
      "lineage_id": "lin-ev-aug21",
      "observation_id": "obs-ev-aug21",
      "input_raw_record_ids": ["raw-ev-determined"],
      "transform_id": "o2.candidate.effective_version",
      "transform_version": "o2.candidate.v1"
    },
    {
      "lineage_id": "lin-ev-sep",
      "observation_id": "obs-ev-sep",
      "input_raw_record_ids": ["raw-ev-determined", "raw-ev-settled"],
      "transform_id": "o2.candidate.effective_version",
      "transform_version": "o2.candidate.v1"
    },
    {
      "lineage_id": "lin-ev-void",
      "observation_id": "obs-ev-void",
      "input_raw_record_ids": ["raw-ev-void"],
      "transform_id": "o2.candidate.effective_version",
      "transform_version": "o2.candidate.v1"
    }
  ]
}
